Peringkat,Judul,Tahun,Sutradara,Durasi_Menit,User_Reviews,Genre,Bintang_Film,Rating,Deskripsi,URL
123,1917,2019,Sam Mendes,119,3500.0,"Epic, Period Drama, War Epic, Action, Drama","Sam Mendes, Krysty Wilson-Cairns, Dean-Charles Chapman, George MacKay, Daniel Mays, Colin Firth",8.2,"April 6th, 1917. As an infantry battalion assembles to wage war deep in enemy territory, two soldiers are assigned to race against time and deliver a message that will stop 1,600 men from walking straight into a deadly trap.",https://www.imdb.com/title/tt8579674/?ref_=chttp_t_123
124,L.A. Confidential,1997,Curtis Hanson,138,912.0,"Conspiracy Thriller, Cop Drama, Period Drama, Police Procedural, Suspense Mystery","Curtis Hanson, James Ellroy, Brian Helgeland, Kevin Spacey, Russell Crowe, Guy Pearce",8.2,"As corruption grows in 1950s Los Angeles, three policemen - one strait-laced, one brutal, and one sleazy - investigate a series of murders with their own brand of justice.",https://www.imdb.com/title/tt0119488/?ref_=chttp_t_124
125,Bicycle Thieves,1948,Vittorio De Sica,89,406.0,"Psychological Drama, Quest, Tragedy, Drama, Financial Drama","Vittorio De Sica, Cesare Zavattini, Luigi Bartolini, Oreste Biancoli, Lamberto Maggiorani, Enzo Staiola",8.2,"In post-war Italy, a working-class man's bicycle is stolen, endangering his efforts to find work. He and his son set out to find it.",https://www.imdb.com/title/tt0040522/?ref_=chttp_t_125
126,Downfall,2004,Oliver Hirschbiegel,156,732.0,"Docudrama, Political Drama, Tragedy, Biography, Drama","Oliver Hirschbiegel, Bernd Eichinger, Joachim Fest, Traudl Junge, Bruno Ganz, Alexandra Maria Lara",8.2,"Traudl Junge, the final secretary for Adolf Hitler, tells of the Nazi dictator's final days in his Berlin bunker at the end of WWII.",https://www.imdb.com/title/tt0363163/?ref_=chttp_t_126
127,Dangal,2016,Nitesh Tiwari,161,519.0,"Coming-of-Age, Martial Arts, Action, Biography, Drama","Nitesh Tiwari, Piyush Gupta, Shreyas Jain, Nikhil Mehrotra, Aamir Khan, Sakshi Tanwar",8.3,"Mahavir Singh Phogat, a former wrestler, decides to fulfill his dream of winning a gold medal for his country by training his daughters for the Commonwealth Games despite the existing social stigmas.",https://www.imdb.com/title/tt5074352/?ref_=chttp_t_127
128,The Wolf of Wall Street,2013,Martin Scorsese,180,1900.0,"Dark Comedy, Docudrama, Epic, Raunchy Comedy, Satire","Martin Scorsese, Terence Winter, Jordan Belfort, Leonardo DiCaprio, Jonah Hill, Margot Robbie",8.2,"Based on the true story of Jordan Belfort, from his rise to a wealthy stock-broker living the high life to his fall involving crime, corruption and the federal government.",https://www.imdb.com/title/tt0993846/?ref_=chttp_t_128
129,Hamilton,2020,Thomas Kail,160,777.0,"Epic, Historical Epic, Biography, Drama, History","Thomas Kail, Lin-Manuel Miranda, Ron Chernow, Phillipa Soo, Leslie Odom Jr., Renée Elise Goldsberry",8.3,"The real life of one of America's foremost founding fathers and first Secretary of the Treasury, Alexander Hamilton. Captured live on Broadway from the Richard Rodgers Theater with the original Broadway cast.",https://www.imdb.com/title/tt8503618/?ref_=chttp_t_129
130,Green Book,2018,Peter Farrelly,130,1800.0,"Docudrama, Period Drama, Road Trip, Biography, Comedy","Peter Farrelly, Nick Vallelonga, Brian Hayes Currie, Viggo Mortensen, Mahershala Ali, Linda Cardellini",8.2,A working-class Italian-American bouncer becomes the driver for an African-American classical pianist on a tour of venues through the 1960s American South.,https://www.imdb.com/title/tt6966692/?ref_=chttp_t_130
131,Taxi Driver,1976,Martin Scorsese,114,1600.0,"Psychological Drama, Crime, Drama, Back to top","Martin Scorsese, Paul Schrader, Robert De Niro, Jodie Foster, Cybill Shepherd, Albert Brooks",8.2,"A mentally unstable veteran works as a nighttime taxi driver in New York City, where the perceived decadence and sleaze fuels his urge for violent action.",https://www.imdb.com/title/tt0075314/?ref_=chttp_t_131
132,Batman Begins,2005,Christopher Nolan,140,3200.0,"Action Epic, Epic, Superhero, Tragedy, Action","Christopher Nolan, Bob Kane, David S. Goyer, Christian Bale, Michael Caine, Ken Watanabe",8.2,"After witnessing his parents' death, billionaire Bruce Wayne learns the art of fighting to confront injustice. When he returns to Gotham as Batman, he must stop a secret society that intends to destroy the city.",https://www.imdb.com/title/tt0372784/?ref_=chttp_t_132
133,The Truman Show,1998,Peter Weir,103,1600.0,"Dark Comedy, High-Concept Comedy, Psychological Drama, Satire, Showbiz Drama","Peter Weir, Andrew Niccol, Jim Carrey, Ed Harris, Laura Linney, Noah Emmerich",8.2,An insurance salesman begins to suspect that his whole life is actually some sort of reality TV show.,https://www.imdb.com/title/tt0120382/?ref_=chttp_t_133
134,For a Few Dollars More,1965,Sergio Leone,132,393.0,"Period Drama, Quest, Spaghetti Western, Drama, Western","Sergio Leone, Fulvio Morsella, Luciano Vincenzoni, Clint Eastwood, Lee Van Cleef, Gian Maria Volontè",8.2,Two bounty killers with similar intentions but different motivations team up to track down a psychotic Mexican outlaw before he and his gang can carry out an audacious bank robbery.,https://www.imdb.com/title/tt0059578/?ref_=chttp_t_134
135,Judgment at Nuremberg,1961,Stanley Kramer,179,289.0,"Legal Drama, Drama, War, Back to top","Stanley Kramer, Abby Mann, Montgomery Clift, Spencer Tracy, Burt Lancaster, Richard Widmark",8.3,"Fictionalized depiction of the 1947 Judges' Trial, the third of 12 trials of Nazi war criminals conducted by the American occupying forces in Nuremberg, Germany, in which former judges of Nazi Germany were tried for their actions.",https://www.imdb.com/title/tt0055031/?ref_=chttp_t_135
136,Some Like It Hot,1959,Billy Wilder,121,531.0,"Buddy Comedy, Farce, Romantic Comedy, Satire, Screwball Comedy","Billy Wilder, I.A.L. Diamond, Robert Thoeren, Marilyn Monroe, Tony Curtis, Jack Lemmon",8.2,"After two male musicians witness a mob hit, they flee the state in an all-female band disguised as women, but further complications set in.",https://www.imdb.com/title/tt0053291/?ref_=chttp_t_136
137,Shutter Island,2010,Martin Scorsese,138,1700.0,"Suspense Mystery, Drama, Mystery, Thriller, Back to top","Martin Scorsese, Laeta Kalogridis, Dennis Lehane, Leonardo DiCaprio, Emily Mortimer, Mark Ruffalo",8.2,Two US marshals are sent to a mental institution on an inhospitable island in order to investigate the disappearance of a patient.,https://www.imdb.com/title/tt1130884/?ref_=chttp_t_137
138,The Kid,1921,Charles Chaplin,68,311.0,"Buddy Comedy, Farce, Slapstick, Comedy, Drama","Charles Chaplin, Edna Purviance, Jackie Coogan, Carl Miller, Albert Austin, Beulah Bains",8.2,"The Tramp cares for an abandoned child, but events put their relationship in jeopardy.",https://www.imdb.com/title/tt0012349/?ref_=chttp_t_138
139,The Father,2020,Florian Zeller,97,1100.0,"Psychological Drama, Drama, Mystery, Back to top","Florian Zeller, Christopher Hampton, Anthony Hopkins, Olivia Colman, Mark Gatiss, Olivia Williams",8.2,"A man refuses all assistance from his daughter as he ages. When he tries to understand what is happening around him, he begins to doubt his loved ones, his own mind and even the fabric of his reality.",https://www.imdb.com/title/tt10272386/?ref_=chttp_t_139
140,Jurassic Park,1993,Steven Spielberg,127,1500.0,"Dinosaur Adventure, Jungle Adventure, Action, Adventure, Sci-Fi","Steven Spielberg, Michael Crichton, David Koepp, Sam Neill, Laura Dern, Jeff Goldblum",8.2,"An industrialist invites some experts to visit his theme park of cloned dinosaurs. After a power failure, the creatures run loose, putting everyone's lives, including his grandchildren's, in danger.",https://www.imdb.com/title/tt0107290/?ref_=chttp_t_140
141,All About Eve,1950,Joseph L. Mankiewicz,138,466.0,"Showbiz Drama, Drama, Back to top","Joseph L. Mankiewicz, Mary Orr, Bette Davis, Anne Baxter, George Sanders, Celeste Holm",8.2,A seemingly timid but secretly ruthless ingénue insinuates herself into the lives of an aging Broadway star and her circle of theater friends.,https://www.imdb.com/title/tt0042192/?ref_=chttp_t_141
142,There Will Be Blood,2007,Paul Thomas Anderson,158,1600.0,"Epic, Period Drama, Psychological Drama, Tragedy, Drama","Paul Thomas Anderson, Upton Sinclair, Daniel Day-Lewis, Paul Dano, Ciarán Hinds, Martin Stringer",8.2,"A story of family, religion, hatred, oil and madness, focusing on a turn-of-the-century prospector in the early days of the business.",https://www.imdb.com/title/tt0469494/?ref_=chttp_t_142
143,The Sixth Sense,1999,M. Night Shyamalan,107,2400.0,"Psychological Drama, Suspense Mystery, Drama, Mystery, Thriller","M. Night Shyamalan, Bruce Willis, Haley Joel Osment, Toni Collette, Olivia Williams, Trevor Morgan",8.2,"After being shot by a resentful former patient whom he failed to help, a Philadelphia child psychologist seeks redemption by treating a young boy with a disturbing secret.",https://www.imdb.com/title/tt0167404/?ref_=chttp_t_143
144,Ran,1985,Akira Kurosawa,160,373.0,"Epic, Period Drama, Samurai, Tragedy, War Epic","Akira Kurosawa, Hideo Oguni, Masato Ide, Tatsuya Nakadai, Akira Terao, Jinpachi Nezu",8.2,"In Medieval Japan, an elderly warlord retires, handing over his empire to his three sons. However, he vastly underestimates how the new-found power will corrupt them and cause them to turn on each other...and him.",https://www.imdb.com/title/tt0089881/?ref_=chttp_t_144
145,Casino,1995,Martin Scorsese,178,821.0,"Docudrama, Epic, Gangster, True Crime, Crime","Martin Scorsese, Nicholas Pileggi, Robert De Niro, Sharon Stone, Joe Pesci, James Woods",8.2,"In Las Vegas, two best friends--a casino executive and a Mafia enforcer--compete for a gambling empire and a fast-living, fast-loving socialite.",https://www.imdb.com/title/tt0112641/?ref_=chttp_t_145
146,Top Gun: Maverick,2022,Joseph Kosinski,130,4400.0,"Action Epic, Epic, Action, Drama, Back to top","Joseph Kosinski, Jim Cash, Jack Epps Jr., Peter Craig, Tom Cruise, Jennifer Connelly",8.2,"The story involves Maverick confronting his past while training a group of younger Top Gun graduates, including the son of his deceased best friend, for a dangerous mission.",https://www.imdb.com/title/tt1745960/?ref_=chttp_t_146
147,No Country for Old Men,2007,Ethan Coen,122,2200.0,"Serial Killer, Crime, Drama, Thriller, Back to top","Ethan Coen, Joel Coen, Cormac McCarthy, Tommy Lee Jones, Javier Bardem, Josh Brolin",8.2,Violence and mayhem ensue after a hunter stumbles upon the aftermath of a drug deal gone wrong and over two million dollars in cash near the Rio Grande.,https://www.imdb.com/title/tt0477348/?ref_=chttp_t_147
148,The Thing,1982,John Carpenter,109,1400.0,"Alien Invasion, Body Horror, Monster Horror, Supernatural Horror, Suspense Mystery","John Carpenter, Bill Lancaster, John W. Campbell Jr., Kurt Russell, Wilford Brimley, Keith David",8.2,A research team in Antarctica is hunted by a shape-shifting alien that assumes the appearance of its victims.,https://www.imdb.com/title/tt0084787/?ref_=chttp_t_148
149,Unforgiven,1992,Clint Eastwood,130,785.0,"Period Drama, Tragedy, Drama, Western, Back to top","Clint Eastwood, David Webb Peoples, Gene Hackman, Morgan Freeman, Richard Harris, Jaimz Woolvett",8.2,"Retired Old West gunslinger Will Munny reluctantly takes on one last job to avenge an injustice with the help of his old partner and a young would-be gunman calling himself ""The Schofield Kid"".",https://www.imdb.com/title/tt0105695/?ref_=chttp_t_149
150,Pan's Labyrinth,2006,Guillermo del Toro,118,1400.0,"Coming-of-Age, Dark Fantasy, Fairy Tale, Period Drama, Teen Fantasy","Guillermo del Toro, Ivana Baquero, Ariadna Gil, Sergi López, Maribel Verdú, Doug Jones",8.2,"In 1944 Spain, a girl is sent to live with her ruthless stepfather. During the night, she meets a fairy who takes her to an old faun. He tells her she's a princess, but must prove her royalty by surviving three gruesome tasks.",https://www.imdb.com/title/tt0457430/?ref_=chttp_t_150
151,Kill Bill: Vol. 1,2003,Quentin Tarantino,111,2500.0,"Kung Fu, Martial Arts, Action, Crime, Thriller","Quentin Tarantino, Uma Thurman, David Carradine, Daryl Hannah, Michael Madsen, Lucy Liu",8.2,"After waking from a four-year coma, a former assassin wreaks vengeance on the team of assassins who betrayed her.",https://www.imdb.com/title/tt0266697/?ref_=chttp_t_151
152,A Beautiful Mind,2001,Ron Howard,135,1400.0,"Docudrama, Period Drama, Psychological Drama, Biography, Drama","Ron Howard, Akiva Goldsman, Sylvia Nasar, Russell Crowe, Ed Harris, Jennifer Connelly",8.2,"A mathematical genius, John Nash made an astonishing discovery early in his career and stood on the brink of international acclaim. But the handsome and arrogant Nash soon found himself on a harrowing journey of self-discovery.",https://www.imdb.com/title/tt0268978/?ref_=chttp_t_152
153,Prisoners,2013,Denis Villeneuve,153,1400.0,"Suspense Mystery, Crime, Drama, Mystery, Thriller","Denis Villeneuve, Aaron Guzikowski, Hugh Jackman, Jake Gyllenhaal, Viola Davis, Melissa Leo",8.2,A desperate father takes the law into his own hands after police fail to find two kidnapped girls.,https://www.imdb.com/title/tt1392214/?ref_=chttp_t_153
154,The Treasure of the Sierra Madre,1948,John Huston,126,349.0,"Tragedy, Adventure, Drama, Western, Back to top","John Huston, B. Traven, Humphrey Bogart, Walter Huston, Tim Holt, Bruce Bennett",8.2,Two down-on-their-luck Americans searching for work in 1920s Mexico convince an old prospector to help them mine for gold in the Sierra Madre Mountains.,https://www.imdb.com/title/tt0040897/?ref_=chttp_t_154
155,The Best of Youth,2003,Marco Tullio Giordana,374,118.0,"Epic, Drama, Romance, Back to top","Marco Tullio Giordana, Sandro Petraglia, Stefano Rulli, Luigi Lo Cascio, Alessio Boni, Jasmine Trinca",8.5,An Italian epic that follows the lives of two brothers from the 1960s to the 2000s.,https://www.imdb.com/title/tt0346336/?ref_=chttp_t_155
156,Yojimbo,1961,Akira Kurosawa,110,258.0,"Period Drama, Samurai, Action, Drama, Thriller","Akira Kurosawa, Ryûzô Kikushima, Toshirô Mifune, Eijirô Tôno, Tatsuya Nakadai, Yôko Tsukasa",8.2,A crafty ronin comes to a town divided by two criminal gangs and decides to play them against each other to free the town.,https://www.imdb.com/title/tt0055630/?ref_=chttp_t_156
157,Finding Nemo,2003,Andrew Stanton,100,1100.0,"Animal Adventure, Buddy Comedy, Computer Animation, Quest, Sea Adventure","Andrew Stanton, Lee Unkrich, Bob Peterson, David Reynolds, Albert Brooks, Ellen DeGeneres",8.2,"After his son is captured in the Great Barrier Reef and taken to Sydney, a timid clownfish sets out on a journey to bring him home.",https://www.imdb.com/title/tt0266543/?ref_=chttp_t_157
158,Howl's Moving Castle,2004,Hayao Miyazaki,119,641.0,"Adventure Epic, Anime, Adventure, Animation, Family","Hayao Miyazaki, Diana Wynne Jones, Chieko Baishô, Takuya Kimura, Tatsuya Gashûin, Akihiro Miwa",8.2,"When an unconfident young woman is cursed with an old body by a spiteful witch, her only chance of breaking the spell lies with a self-indulgent yet insecure young wizard and his companions in his legged, walking castle.",https://www.imdb.com/title/tt0347149/?ref_=chttp_t_158
159,The Great Escape,1963,John Sturges,172,479.0,"Epic, Period Drama, Prison Drama, War Epic, Adventure","John Sturges, Paul Brickhill, James Clavell, W.R. Burnett, Steve McQueen, James Garner",8.2,Allied officers in a German prisoner of war camp during World War II make a daring plan for a mass escape by hundreds of POWs hoping to draw German personnel and resources away from combat operations.,https://www.imdb.com/title/tt0057115/?ref_=chttp_t_159
160,Monty Python and the Holy Grail,1975,Terry Gilliam,91,898.0,"Farce, Parody, Quest, Satire, Sketch Comedy","Terry Gilliam, Terry Jones, Graham Chapman, John Cleese, Eric Idle, Michael Palin",8.2,"King Arthur and his Knights of the Round Table embark on a surreal, low-budget search for the Holy Grail, encountering many, very silly obstacles.",https://www.imdb.com/title/tt0071853/?ref_=chttp_t_160
161,The Elephant Man,1980,David Lynch,124,578.0,"Docudrama, Period Drama, Tragedy, Biography, Drama","David Lynch, Christopher De Vore, Eric Bergren, Anthony Hopkins, John Hurt, Anne Bancroft",8.2,"A Victorian surgeon rescues a heavily disfigured man who is mistreated while scraping a living as a side-show freak. Behind his monstrous façade, there is revealed a person of kindness, intelligence and sophistication.",https://www.imdb.com/title/tt0080678/?ref_=chttp_t_161
162,Dial M for Murder,1954,Alfred Hitchcock,105,456.0,"Crime, Drama, Mystery, Thriller, Back to top","Alfred Hitchcock, Frederick Knott, Ray Milland, Grace Kelly, Robert Cummings, John Williams",8.2,"A London playboy plots the perfect murder of his rich, unfaithful Wife.",https://www.imdb.com/title/tt0046912/?ref_=chttp_t_162
163,Klaus,2019,Sergio Pablos,96,900.0,"Holiday Animation, Holiday Comedy, Holiday Family, Adventure, Animation","Sergio Pablos, Carlos Martínez López, Jim Mahoney, Zach Lewis, Jason Schwartzman, J.K. Simmons",8.2,"A simple act of kindness always sparks another, even in a frozen, faraway place. When Smeerensburg's new postman, Jesper, befriends toymaker Klaus, their gifts melt an age-old feud and deliver a sleigh full of holiday traditions.",https://www.imdb.com/title/tt4729430/?ref_=chttp_t_163
164,Gone with the Wind,1939,Victor Fleming,238,1000.0,"Costume Drama, Epic, Period Drama, Romantic Epic, Tragic Romance","Victor Fleming, Margaret Mitchell, Sidney Howard, Oliver H.P. Garrett, Clark Gable, Vivien Leigh",8.2,A sheltered and manipulative Southern belle and a roguish profiteer face off in a turbulent romance as the society around them crumbles with the end of slavery and is rebuilt during the Civil War and Reconstruction periods.,https://www.imdb.com/title/tt0031381/?ref_=chttp_t_164
165,Chinatown,1974,Roman Polanski,130,683.0,"Conspiracy Thriller, Psychological Drama, Tragedy, Drama, Mystery","Roman Polanski, Robert Towne, Jack Nicholson, Faye Dunaway, John Huston, Perry Lopez",8.1,"A private detective hired to expose an adulterer in 1930s Los Angeles finds himself caught up in a web of deceit, corruption, and murder.",https://www.imdb.com/title/tt0071315/?ref_=chttp_t_165
166,The Secret in Their Eyes,2009,Juan José Campanella,129,378.0,"Dark Romance, Erotic Thriller, Legal Thriller, Period Drama, Psychological Drama","Juan José Campanella, Eduardo Sacheri, Ricardo Darín, Soledad Villamil, Pablo Rago, Carla Quevedo",8.2,"A retired legal counselor writes a novel hoping to find closure for one of his past unresolved homicide cases, and for his unreciprocated love with his superior--both of which still haunt him decades later.",https://www.imdb.com/title/tt1305806/?ref_=chttp_t_166
167,"Lock, Stock and Two Smoking Barrels",1998,Guy Ritchie,107,675.0,"Dark Comedy, Farce, Gangster, Heist, Comedy","Guy Ritchie, Jason Flemyng, Dexter Fletcher, Nick Moran, Jason Statham, Steven Mackintosh",8.1,"When four small-time criminals lose a rigged poker game against a London kingpin, he gives them one week to settle their enormous debt.",https://www.imdb.com/title/tt0120735/?ref_=chttp_t_167
168,Rashomon,1950,Akira Kurosawa,88,440.0,"Period Drama, Crime, Drama, Mystery, Back to top","Akira Kurosawa, Ryûnosuke Akutagawa, Shinobu Hashimoto, Toshirô Mifune, Machiko Kyô, Masayuki Mori",8.1,"The rape of a bride and the murder of her samurai husband are recalled from the perspectives of a bandit, the bride, the samurai's ghost and a woodcutter.",https://www.imdb.com/title/tt0042876/?ref_=chttp_t_168
169,V for Vendetta,2005,James McTeigue,132,2500.0,"Dystopian Sci-Fi, Political Thriller, Superhero, Action, Drama","James McTeigue, Lilly Wachowski, Lana Wachowski, David Lloyd, Hugo Weaving, Natalie Portman",8.1,"In a future British dystopian society, a shadowy freedom fighter, known only by the alias of ""V"", plots to overthrow the tyrannical government - with the help of a young woman.",https://www.imdb.com/title/tt0434409/?ref_=chttp_t_169
170,Inside Out,2015,Pete Docter,95,1300.0,"Coming-of-Age, Computer Animation, Farce, Psychological Drama, Adventure","Pete Docter, Ronnie Del Carmen, Meg LeFauve, Amy Poehler, Bill Hader, Lewis Black",8.1,"After young Riley is uprooted from her Midwest life and moved to San Francisco, her emotions - Joy, Fear, Anger, Disgust and Sadness - conflict on how best to navigate a new city, house, and school.",https://www.imdb.com/title/tt2096673/?ref_=chttp_t_170
171,"Three Billboards Outside Ebbing, Missouri",2017,Martin McDonagh,115,1400.0,"Dark Comedy, Satire, Comedy, Crime, Drama","Martin McDonagh, Frances McDormand, Woody Harrelson, Sam Rockwell, Caleb Landry Jones, Kerry Condon",8.1,A mother personally challenges the local authorities to solve her daughter's murder when they fail to catch the culprit.,https://www.imdb.com/title/tt5027774/?ref_=chttp_t_171
172,Catch Me If You Can,2002,Steven Spielberg,141,1000.0,"Caper, Coming-of-Age, Docudrama, Period Drama, True Crime","Steven Spielberg, Frank Abagnale Jr., Stan Redding, Jeff Nathanson, Leonardo DiCaprio, Tom Hanks",8.1,"Barely 17 yet, Frank is a skilled forger who has passed as a doctor, lawyer and pilot. FBI agent Carl becomes obsessed with tracking down the con man, who only revels in the pursuit.",https://www.imdb.com/title/tt0264464/?ref_=chttp_t_172
173,Trainspotting,1996,Danny Boyle,93,742.0,"Dark Comedy, Drug Crime, Psychological Drama, Crime, Drama","Danny Boyle, Irvine Welsh, John Hodge, Ewan McGregor, Ewen Bremner, Jonny Lee Miller",8.1,"Renton, deeply immersed in the Edinburgh drug scene, tries to clean up and get out despite the allure of drugs and the influence of friends.",https://www.imdb.com/title/tt0117951/?ref_=chttp_t_173
174,The Bridge on the River Kwai,1957,David Lean,161,412.0,"Jungle Adventure, War Epic, Adventure, Drama, War","David Lean, Pierre Boulle, Carl Foreman, Michael Wilson, William Holden, Alec Guinness",8.1,"British POWs are forced to build a railway bridge across the river Kwai for their Japanese captors in occupied Burma, not knowing that the allied forces are planning a daring commando raid through the jungle to destroy it.",https://www.imdb.com/title/tt0050212/?ref_=chttp_t_174
175,Raging Bull,1980,Martin Scorsese,129,721.0,"Boxing, Docudrama, Period Drama, Biography, Drama","Martin Scorsese, Jake LaMotta, Joseph Carter, Peter Savage, Robert De Niro, Cathy Moriarty",8.1,"The life of boxer Jake LaMotta, whose violence and temper that led him to the top in the ring destroyed his life outside of it.",https://www.imdb.com/title/tt0081398/?ref_=chttp_t_175
176,The Wild Robot,2024,Chris Sanders,102,962.0,"Animal Adventure, Computer Animation, Survival, Adventure, Animation","Chris Sanders, Peter Brown, Lupita Nyong'o, Pedro Pascal, Kit Connor, Bill Nighy",8.2,"After a shipwreck, an intelligent robot called Roz is stranded on an uninhabited island. To survive the harsh environment, Roz bonds with the island's animals and cares for an orphaned baby goose.",https://www.imdb.com/title/tt29623480/?ref_=chttp_t_176
177,Fargo,1996,Joel Coen,98,1100.0,"Cop Drama, Dark Comedy, Police Procedural, Tragedy, Crime","Joel Coen, Ethan Coen, William H. Macy, Frances McDormand, Steve Buscemi, Peter Stormare",8.1,Minnesota car salesman Jerry Lundegaard's inept crime falls apart due to his and his henchmen's bungling and the persistent police work of the quite pregnant Marge Gunderson.,https://www.imdb.com/title/tt0116282/?ref_=chttp_t_177
178,Harry Potter and the Deathly Hallows: Part 2,2011,David Yates,130,1100.0,"Dark Fantasy, Fantasy Epic, Teen Adventure, Teen Fantasy, Tragedy","David Yates, Steve Kloves, J.K. Rowling, Daniel Radcliffe, Emma Watson, Rupert Grint",8.1,"As the battle between the forces of good and evil in the wizarding world escalates, Harry Potter draws ever closer to his final confrontation with Voldemort.",https://www.imdb.com/title/tt1201607/?ref_=chttp_t_178
179,Warrior,2011,Gavin O'Connor,140,890.0,"Boxing, Action, Drama, Sport, Back to top","Gavin O'Connor, Anthony Tambakis, Cliff Dorfman, Tom Hardy, Nick Nolte, Joel Edgerton",8.1,"The youngest son of an alcoholic former boxer returns home, where he's trained by his father for competition in a mixed martial arts tournament - a path that puts the fighter on a collision course with his estranged, older brother.",https://www.imdb.com/title/tt1291584/?ref_=chttp_t_179
180,Gran Torino,2008,Clint Eastwood,116,1100.0,"Dark Comedy, Psychological Drama, Drama, Back to top","Clint Eastwood, Nick Schenk, Dave Johannson, Bee Vang, Christopher Carley, Ahney Her",8.1,"After a Hmong teenager tries to steal his prized 1972 Gran Torino, a disgruntled, prejudiced Korean War veteran seeks to redeem both the boy and himself.",https://www.imdb.com/title/tt1205489/?ref_=chttp_t_180
181,Million Dollar Baby,2004,Clint Eastwood,132,1400.0,"Boxing, Psychological Drama, Tragedy, Drama, Sport","Clint Eastwood, Paul Haggis, F.X. Toole, Hilary Swank, Morgan Freeman, Jay Baruchel",8.1,"Frankie, an ill-tempered old coach, reluctantly agrees to train aspiring boxer Maggie. Impressed with her determination and talent, he helps her become the best and the two soon form a close bond.",https://www.imdb.com/title/tt0405159/?ref_=chttp_t_181
182,Ben-Hur,1959,William Wyler,212,535.0,"Adventure Epic, Epic, Period Drama, Sword & Sandal, Adventure","William Wyler, Lew Wallace, Karl Tunberg, Gore Vidal, Charlton Heston, Jack Hawkins",8.1,"A Jewish prince is betrayed and sent into slavery by a Roman friend in 1st-century Jerusalem, but it's not long before he regains his freedom and comes back for revenge.",https://www.imdb.com/title/tt0052618/?ref_=chttp_t_182
