Peringkat,Judul,Tahun,Sutradara,Durasi_Menit,User_Reviews,Genre,Bintang_Film,Rating,Deskripsi,URL
62,Sunset Boulevard,1950,Billy Wilder,110,789.0,"Dark Comedy, Film Noir, Psychological Drama, Showbiz Drama, Tragedy","Billy Wilder, Charles Brackett, D.M. Marshman Jr., William Holden, Gloria Swanson, Erich von Stroheim",8.4,A screenwriter develops a dangerous relationship with a faded film star determined to make a triumphant return.,https://www.imdb.com/title/tt0043014/?ref_=chttp_t_62
63,Spider-Man: Into the Spider-Verse,2018,Bob Persichetti,117,2200.0,"Coming-of-Age, Computer Animation, Quirky Comedy, Superhero, Teen Adventure","Bob Persichetti, Peter Ramsey, Rodney Rothman, Phil Lord, Shameik Moore, Jake Johnson",8.4,Teen Miles Morales becomes the Spider-Man of his universe and must join with five spider-powered individuals from other dimensions to stop a threat for all realities.,https://www.imdb.com/title/tt4633694/?ref_=chttp_t_63
64,Witness for the Prosecution,1957,Billy Wilder,116,399.0,"Legal Drama, Legal Thriller, Whodunnit, Crime, Drama","Billy Wilder, Agatha Christie, Harry Kurnitz, Tyrone Power, Marlene Dietrich, Charles Laughton",8.4,A veteran British barrister must defend his client in a murder trial that has surprise after surprise.,https://www.imdb.com/title/tt0051201/?ref_=chttp_t_64
65,Paths of Glory,1957,Stanley Kubrick,88,570.0,"Epic, Legal Drama, Period Drama, Political Drama, Psychological Drama","Stanley Kubrick, Calder Willingham, Jim Thompson, Kirk Douglas, Ralph Meeker, Adolphe Menjou",8.4,A colonel defends three of his soldiers in a court-martial after they abandon a suicidal attack.,https://www.imdb.com/title/tt0050825/?ref_=chttp_t_65
66,The Shining,1980,Stanley Kubrick,146,2300.0,"Psychological Drama, Supernatural Horror, Drama, Horror, Back to top","Stanley Kubrick, Stephen King, Diane Johnson, Jack Nicholson, Shelley Duvall, Danny Lloyd",8.4,"A family heads to an isolated hotel for the winter, where a sinister presence influences the father into violence. At the same time, his psychic son sees horrifying forebodings from both the past and the future.",https://www.imdb.com/title/tt0081505/?ref_=chttp_t_66
67,The Great Dictator,1940,Charles Chaplin,125,356.0,"Dark Comedy, Parody, Political Drama, Satire, Slapstick","Charles Chaplin, Paulette Goddard, Jack Oakie, Reginald Gardiner, Henry Daniell, Billy Gilbert",8.4,Dictator Adenoid Hynkel tries to expand his empire while a poor Jewish barber tries to avoid persecution from Hynkel's regime.,https://www.imdb.com/title/tt0032553/?ref_=chttp_t_67
68,12th Fail,2023,Vidhu Vinod Chopra,147,1000.0,"Docudrama, Biography, Drama, Back to top","Vidhu Vinod Chopra, Jaskunwar Kohli, Anurag Pathak, Vikrant Massey, Medha Shankr, Anant Joshi",8.7,The real-life story of IPS Officer Manoj Kumar Sharma and IRS Officer Shraddha Joshi.,https://www.imdb.com/title/tt23849204/?ref_=chttp_t_68
69,Inglourious Basterds,2009,Quentin Tarantino,153,2200.0,"Dark Comedy, Period Drama, Adventure, Drama, War","Quentin Tarantino, Brad Pitt, Diane Kruger, Eli Roth, Mélanie Laurent, Christoph Waltz",8.4,"In Nazi-occupied France during World War II, a plan to assassinate Nazi leaders by a group of Jewish U.S. soldiers coincides with a theatre owner's vengeful plans for the same.",https://www.imdb.com/title/tt0361748/?ref_=chttp_t_69
70,Aliens,1986,James Cameron,137,1600.0,"Alien Invasion, Cyberpunk, Monster Horror, Space Sci-Fi, Survival","James Cameron, David Giler, Walter Hill, Sigourney Weaver, Michael Biehn, Carrie Henn",8.4,"Decades after surviving the Nostromo incident, Ellen Ripley is sent out to re-establish contact with a terraforming colony but finds herself battling the Alien Queen and her offspring.",https://www.imdb.com/title/tt0090605/?ref_=chttp_t_70
71,The Dark Knight Rises,2012,Christopher Nolan,164,4000.0,"Action Epic, Epic, Superhero, Action, Crime","Christopher Nolan, Jonathan Nolan, David S. Goyer, Christian Bale, Tom Hardy, Anne Hathaway",8.4,"Bane, an imposing terrorist, attacks Gotham City and disrupts its eight-year-long period of peace. This forces Bruce Wayne to come out of hiding and don the cape and cowl of Batman again.",https://www.imdb.com/title/tt1345836/?ref_=chttp_t_71
72,Coco,2017,Lee Unkrich,105,1400.0,"Computer Animation, Dark Comedy, Adventure, Animation, Drama","Lee Unkrich, Adrian Molina, Jason Katz, Matthew Aldrich, Anthony Gonzalez, Gael García Bernal",8.4,"Aspiring musician Miguel, confronted with his family's ancestral ban on music, enters the Land of the Dead to find his great-great-grandfather, a legendary singer.",https://www.imdb.com/title/tt2380307/?ref_=chttp_t_72
73,Amadeus,1984,Milos Forman,160,795.0,"Costume Drama, Epic, Period Drama, Tragedy, Biography","Milos Forman, Peter Shaffer, Zdenek Mahler, F. Murray Abraham, Tom Hulce, Elizabeth Berridge",8.4,"The life and work of Wolfgang Amadeus Mozart seen through the eyes of his contemporary and rival, Antonio Salieri.",https://www.imdb.com/title/tt0086879/?ref_=chttp_t_73
74,Avengers: Endgame,2019,Anthony Russo,181,9600.0,"Space Sci-Fi, Superhero, Time Travel, Tragedy, Action","Anthony Russo, Joe Russo, Christopher Markus, Stephen McFeely, Stan Lee, Robert Downey Jr.",8.4,"After the devastating events of Avengers: Infinity War (2018), the universe is in ruins. With the help of remaining allies, the Avengers assemble once more in order to reverse Thanos' actions and restore balance to the universe.",https://www.imdb.com/title/tt4154796/?ref_=chttp_t_74
75,Toy Story,1995,John Lasseter,81,827.0,"Buddy Comedy, Computer Animation, Urban Adventure, Adventure, Animation","John Lasseter, Pete Docter, Andrew Stanton, Tom Hanks, Tim Allen, Don Rickles",8.3,"A cowboy doll is profoundly jealous when a new spaceman action figure supplants him as the top toy in a boy's bedroom. When circumstances separate them from their owner, the duo have to put aside their differences to return to him.",https://www.imdb.com/title/tt0114709/?ref_=chttp_t_75
76,Good Will Hunting,1997,Gus Van Sant,126,1200.0,"Coming-of-Age, Psychological Drama, Drama, Romance, Back to top","Gus Van Sant, Matt Damon, Ben Affleck, Robin Williams, Stellan Skarsgård, John Mighton",8.3,"A therapist counsels Will Hunting, a janitor with a genius IQ.",https://www.imdb.com/title/tt0119217/?ref_=chttp_t_76
77,Dr. Strangelove or: How I Learned to Stop Worrying and Love the Bomb,1964,Stanley Kubrick,95,1100.0,"Dark Comedy, Farce, Political Drama, Quirky Comedy, Satire","Stanley Kubrick, Terry Southern, Peter George, Peter Sellers, George C. Scott, Sterling Hayden",8.3,"A mentally unstable American general orders a hydrogen bomb attack on the Soviet Union, triggering a path to global nuclear holocaust that a war room full of politicians and generals frantically tries to stop.",https://www.imdb.com/title/tt0057012/?ref_=chttp_t_77
78,Oldboy,2003,Park Chan-wook,120,1300.0,"Dark Comedy, Psychological Drama, Action, Drama, Mystery","Park Chan-wook, Garon Tsuchiya, Nobuaki Minegishi, Choi Min-sik, Yoo Ji-tae, Kang Hye-jeong",8.3,"After being kidnapped and imprisoned for fifteen years, Oh Dae-Su is released, only to find that he must track down his captor in five days.",https://www.imdb.com/title/tt0364569/?ref_=chttp_t_78
79,Das Boot,1981,Wolfgang Petersen,149,615.0,"Epic, War Epic, Drama, War, Back to top","Wolfgang Petersen, Lothar G. Buchheim, Jürgen Prochnow, Herbert Grönemeyer, Klaus Wennemann, Hubertus Bengsch",8.4,A German U-boat stalks the frigid waters of the North Atlantic as its young crew experience the sheer terror and claustrophobic life of a submariner in World War II.,https://www.imdb.com/title/tt0082096/?ref_=chttp_t_79
80,High and Low,1963,Akira Kurosawa,143,190.0,"Police Procedural, Crime, Drama, Mystery, Thriller","Akira Kurosawa, Hideo Oguni, Ryûzô Kikushima, Eijirô Hisaita, Toshirô Mifune, Yutaka Sada",8.4,An executive of a Yokohama shoe company becomes a victim of extortion when his chauffeur's son is kidnapped by mistake and held for ransom.,https://www.imdb.com/title/tt0057565/?ref_=chttp_t_80
81,Braveheart,1995,Mel Gibson,178,1500.0,"Action Epic, Costume Drama, Epic, Period Drama, War Epic","Mel Gibson, Randall Wallace, Sophie Marceau, Patrick McGoohan, Angus Macfadyen, James Robinson",8.3,Scottish warrior William Wallace leads his countrymen in a rebellion to free his homeland from the tyranny of King Edward I of England.,https://www.imdb.com/title/tt0112573/?ref_=chttp_t_81
82,American Beauty,1999,Sam Mendes,122,3100.0,"Psychological Drama, Tragedy, Drama, Back to top","Sam Mendes, Alan Ball, Kevin Spacey, Annette Bening, Thora Birch, Wes Bentley",8.3,A sexually frustrated suburban father has a mid-life crisis after becoming infatuated with his daughter's best friend.,https://www.imdb.com/title/tt0169547/?ref_=chttp_t_82
83,Princess Mononoke,1997,Hayao Miyazaki,133,876.0,"Action Epic, Adult Animation, Adventure Epic, Anime, Dark Fantasy","Hayao Miyazaki, Yôji Matsuda, Yuriko Ishida, Yûko Tanaka, Billy Crudup, Billy Bob Thornton",8.3,"While seeking to cure himself of a curse, young warrior Ashitaka stumbles into a conflict between the people of Iron Town and Princess Mononoke, a girl raised by wolves, who will stop at nothing to prevent the destruction of her home.",https://www.imdb.com/title/tt0119698/?ref_=chttp_t_83
84,Your Name.,2016,Makoto Shinkai,106,1000.0,"Anime, Psychological Drama, Shōjo, Animation, Drama","Makoto Shinkai, Ryûnosuke Kamiki, Mone Kamishiraishi, Ryo Narita, Aoi Yûki, Nobunaga Shimazaki",8.4,"Two teenagers share a profound, magical connection upon discovering they are swapping bodies. Things manage to become even more complicated when the boy and girl decide to meet in person.",https://www.imdb.com/title/tt5311514/?ref_=chttp_t_84
85,3 Idiots,2009,Rajkumar Hirani,170,1000.0,"Buddy Comedy, Coming-of-Age, Quirky Comedy, Satire, Comedy","Rajkumar Hirani, Abhijat Joshi, Vidhu Vinod Chopra, Aamir Khan, Madhavan, Mona Singh",8.4,"Two friends are searching for their long lost companion. They revisit their college days and recall the memories of their friend who inspired them to think differently, even as the rest of the world called them ""idiots"".",https://www.imdb.com/title/tt1187043/?ref_=chttp_t_85
86,Joker,2019,Todd Phillips,122,11600.0,"Psychological Drama, Tragedy, Crime, Drama, Thriller","Todd Phillips, Scott Silver, Bob Kane, Joaquin Phoenix, Robert De Niro, Zazie Beetz",8.3,"Arthur Fleck, a party clown and a failed stand-up comedian, leads an impoverished life with his ailing mother. However, when society shuns him and brands him as a freak, he decides to embrace the life of chaos in Gotham City.",https://www.imdb.com/title/tt7286456/?ref_=chttp_t_86
87,Capernaum,2018,Nadine Labaki,126,523.0,"Coming-of-Age, Legal Drama, Psychological Drama, Drama, Back to top","Nadine Labaki, Jihad Hojeily, Michelle Keserwany, Zain Al Rafeea, Yordanos Shiferaw, Boluwatife Treasure Bankole",8.4,"While serving a five-year sentence for a violent crime, a 12-year-old boy sues his parents for neglect.",https://www.imdb.com/title/tt8267604/?ref_=chttp_t_87
88,Once Upon a Time in America,1984,Sergio Leone,229,909.0,"Dark Comedy, Epic, Gangster, Period Drama, Crime","Sergio Leone, Harry Grey, Leonardo Benvenuti, Piero De Bernardi, Robert De Niro, James Woods",8.3,"A former Prohibition-era Jewish gangster returns to the Lower East Side of Manhattan 35 years later, where he must once again confront the ghosts and regrets of his old life.",https://www.imdb.com/title/tt0087843/?ref_=chttp_t_88
89,Singin' in the Rain,1952,Stanley Donen,103,846.0,"Classic Musical, Feel-Good Romance, Jukebox Musical, Romantic Comedy, Satire","Stanley Donen, Gene Kelly, Betty Comden, Adolph Green, Donald O'Connor, Debbie Reynolds",8.3,A silent film star falls for a chorus girl just as he and his delusionally jealous screen partner are trying to make the difficult transition to talking pictures in 1920s Hollywood.,https://www.imdb.com/title/tt0045152/?ref_=chttp_t_89
90,Come and See,1985,Elem Klimov,142,717.0,"Epic, Period Drama, Psychological Drama, Tragedy, War Epic","Elem Klimov, Ales Adamovich, Aleksey Kravchenko, Olga Mironova, Liubomiras Laucevicius, Vladas Bagdonas",8.3,"After finding an old rifle, a young boy joins the Soviet resistance movement against ruthless German forces and experiences the horrors of World War II.",https://www.imdb.com/title/tt0091251/?ref_=chttp_t_90
91,Requiem for a Dream,2000,Darren Aronofsky,102,2500.0,"Psychological Drama, Tragedy, Drama, Back to top","Darren Aronofsky, Hubert Selby Jr., Ellen Burstyn, Jared Leto, Jennifer Connelly, Marlon Wayans",8.3,The drug-induced utopias of four Coney Island people are shattered when their addictions run deep.,https://www.imdb.com/title/tt0180093/?ref_=chttp_t_91
92,Star Wars: Episode VI - Return of the Jedi,1983,Richard Marquand,131,1000.0,"Action Epic, Adventure Epic, Dark Fantasy, Dystopian Sci-Fi, Epic","Richard Marquand, Lawrence Kasdan, George Lucas, Mark Hamill, Harrison Ford, Carrie Fisher",8.3,"After rescuing Han Solo from Jabba the Hutt, the Rebel Alliance attempts to destroy the second Death Star while Luke struggles to help Darth Vader back from the dark side.",https://www.imdb.com/title/tt0086190/?ref_=chttp_t_92
93,Toy Story 3,2010,Lee Unkrich,103,1000.0,"Computer Animation, Urban Adventure, Adventure, Animation, Comedy","Lee Unkrich, John Lasseter, Andrew Stanton, Tom Hanks, Tim Allen, Joan Cusack",8.3,"The toys are mistakenly delivered to a day-care center instead of the attic right before Andy leaves for college, and it's up to Woody to convince the other toys that they weren't abandoned and to return home.",https://www.imdb.com/title/tt0435761/?ref_=chttp_t_93
94,The Hunt,2012,Thomas Vinterberg,115,624.0,"Psychological Drama, Tragedy, Drama, Back to top","Thomas Vinterberg, Tobias Lindholm, Mads Mikkelsen, Thomas Bo Larsen, Annika Wedderkopp, Lasse Fogelstrøm",8.3,"A teacher lives a lonely life, all the while struggling over his son's custody. His life slowly gets better as he finds love and receives good news from his son, but his new luck is about to be brutally shattered by an innocent little lie.",https://www.imdb.com/title/tt2106476/?ref_=chttp_t_94
95,Ikiru,1952,Akira Kurosawa,143,310.0,"Psychological Drama, Tragedy, Drama, Back to top","Akira Kurosawa, Shinobu Hashimoto, Hideo Oguni, Takashi Shimura, Nobuo Kaneko, Shin'ichi Himori",8.3,A bureaucrat tries to find meaning in his life after he discovers he has terminal cancer.,https://www.imdb.com/title/tt0044741/?ref_=chttp_t_95
96,Eternal Sunshine of the Spotless Mind,2004,Michel Gondry,108,2200.0,"Dark Romance, Psychological Drama, Drama, Romance, Sci-Fi","Michel Gondry, Charlie Kaufman, Pierre Bismuth, Jim Carrey, Kate Winslet, Tom Wilkinson",8.3,"When their relationship turns sour, a couple undergoes a medical procedure to have each other erased from their memories forever.",https://www.imdb.com/title/tt0338013/?ref_=chttp_t_96
97,Incendies,2010,Denis Villeneuve,131,433.0,"Suspense Mystery, Drama, Mystery, War, Back to top","Denis Villeneuve, Wajdi Mouawad, Valérie Beaugrand-Champagne, Lubna Azabal, Mélissa Désormeaux-Poulin, Maxim Gaudette",8.3,Twins journey to the Middle East to discover their family history and fulfill their mother's last wishes.,https://www.imdb.com/title/tt1255953/?ref_=chttp_t_97
98,2001: A Space Odyssey,1968,Stanley Kubrick,149,2700.0,"Adventure Epic, Epic, Psychological Drama, Sci-Fi Epic, Space Sci-Fi","Stanley Kubrick, Arthur C. Clarke, Keir Dullea, Gary Lockwood, William Sylvester, Daniel Richter",8.3,"When a mysterious artifact is uncovered on the Moon, a spacecraft manned by two humans and one supercomputer is sent to Jupiter to find its origins.",https://www.imdb.com/title/tt0062622/?ref_=chttp_t_98
99,The Apartment,1960,Billy Wilder,125,469.0,"Dark Comedy, Farce, Feel-Good Romance, Holiday Comedy, Holiday Romance","Billy Wilder, I.A.L. Diamond, Jack Lemmon, Shirley MacLaine, Fred MacMurray, Ray Walston",8.3,"A Manhattan insurance clerk tries to rise in his company by letting its executives use his apartment for trysts, but office politics and his own romantic hopes complicate matters.",https://www.imdb.com/title/tt0053604/?ref_=chttp_t_99
100,Lawrence of Arabia,1962,David Lean,227,828.0,"Adventure Epic, Desert Adventure, Epic, Tragedy, War Epic","David Lean, Robert Bolt, Michael Wilson, Peter O'Toole, Alec Guinness, Anthony Quinn",8.3,"The story of T.E. Lawrence, the English officer who successfully united and led the diverse, often warring, Arab tribes during World War I in order to fight the Turks.",https://www.imdb.com/title/tt0056172/?ref_=chttp_t_100
101,Reservoir Dogs,1992,Quentin Tarantino,99,1400.0,"Gangster, Heist, Crime, Thriller, Back to top","Quentin Tarantino, Roger Avary, Harvey Keitel, Tim Roth, Michael Madsen, Chris Penn",8.3,"When a simple jewelry heist goes horribly wrong, the surviving criminals begin to suspect that one of them is a police informant.",https://www.imdb.com/title/tt0105236/?ref_=chttp_t_101
102,Scarface,1983,Brian De Palma,170,1300.0,"Drug Crime, Epic, Gangster, Tragedy, Crime","Brian De Palma, Oliver Stone, Howard Hawks, Ben Hecht, Al Pacino, Michelle Pfeiffer",8.3,"In the 1980s, a determined criminal-minded Cuban immigrant becomes the biggest drug smuggler in Miami, and is eventually undone by his own drug addiction.",https://www.imdb.com/title/tt0086250/?ref_=chttp_t_102
103,Heat,1995,Michael Mann,170,1500.0,"Action Epic, Cop Drama, Epic, Gangster, Heist","Michael Mann, Al Pacino, Robert De Niro, Val Kilmer, Jon Voight, Tom Sizemore",8.3,A group of high-end professional thieves start to feel the heat from the LAPD when they unknowingly leave a verbal clue at their latest heist.,https://www.imdb.com/title/tt0113277/?ref_=chttp_t_103
104,Double Indemnity,1944,Billy Wilder,107,512.0,"Film Noir, Crime, Drama, Mystery, Thriller","Billy Wilder, Raymond Chandler, James M. Cain, Fred MacMurray, Barbara Stanwyck, Edward G. Robinson",8.3,"An insurance representative is seduced by a dissatisfied housewife into a scheme of insurance fraud and murder that arouses the suspicion of his colleague, a claims investigator.",https://www.imdb.com/title/tt0036775/?ref_=chttp_t_104
105,North by Northwest,1959,Alfred Hitchcock,136,793.0,"Spy, Adventure, Drama, Mystery, Thriller","Alfred Hitchcock, Ernest Lehman, Cary Grant, Eva Marie Saint, James Mason, Jessie Royce Landis",8.3,"A New York City advertising executive goes on the run after being mistaken for a government agent by a group of foreign spies, and falls for a woman whose loyalties he begins to doubt.",https://www.imdb.com/title/tt0053125/?ref_=chttp_t_105
106,Up,2009,Pete Docter,96,1100.0,"Buddy Comedy, Coming-of-Age, Computer Animation, Quest, Adventure","Pete Docter, Bob Peterson, Tom McCarthy, Edward Asner, Jordan Nagai, John Ratzenberger",8.3,"78-year-old Carl Fredricksen travels to South America in his house equipped with balloons, inadvertently taking a young stowaway.",https://www.imdb.com/title/tt1049413/?ref_=chttp_t_106
107,M,1931,Fritz Lang,99,460.0,"Serial Killer, Suspense Mystery, Crime, Mystery, Thriller","Fritz Lang, Thea von Harbou, Egon Jacobsohn, Peter Lorre, Ellen Widmann, Inge Landgut",8.3,"When the police in a German city are unable to catch a child-murderer, other criminals join in the manhunt.",https://www.imdb.com/title/tt0022100/?ref_=chttp_t_107
108,Citizen Kane,1941,Orson Welles,119,1700.0,"Epic, Period Drama, Tragedy, Drama, Mystery","Orson Welles, Herman J. Mankiewicz, John Houseman, Joseph Cotten, Dorothy Comingore, Agnes Moorehead",8.3,"Following the death of publishing tycoon Charles Foster Kane, reporters scramble to uncover the meaning of his final utterance: 'Rosebud.'",https://www.imdb.com/title/tt0033467/?ref_=chttp_t_108
109,Full Metal Jacket,1987,Stanley Kubrick,116,1000.0,"Dark Comedy, Period Drama, Psychological Drama, Drama, War","Stanley Kubrick, Michael Herr, Gustav Hasford, Matthew Modine, R. Lee Ermey, Vincent D'Onofrio",8.2,A pragmatic U.S. Marine observes the dehumanizing effects the Vietnam War has on his fellow recruits from their brutal boot camp training to the bloody street fighting in Hue.,https://www.imdb.com/title/tt0093058/?ref_=chttp_t_109
110,Vertigo,1958,Alfred Hitchcock,128,1100.0,"Suspense Mystery, Tragedy, Mystery, Romance, Thriller","Alfred Hitchcock, Alec Coppel, Samuel A. Taylor, Pierre Boileau, James Stewart, Kim Novak",8.2,"A former San Francisco police detective juggles wrestling with his personal demons and becoming obsessed with the hauntingly beautiful woman he has been hired to trail, who may be deeply disturbed.",https://www.imdb.com/title/tt0052357/?ref_=chttp_t_110
111,Amélie,2001,Jean-Pierre Jeunet,122,1600.0,"Feel-Good Romance, Quirky Comedy, Romantic Comedy, Comedy, Romance","Jean-Pierre Jeunet, Guillaume Laurant, Audrey Tautou, Mathieu Kassovitz, Rufus, Lorella Cravotta",8.3,"Despite being caught in her imaginative world, young waitress Amelie decides to help people find happiness. Her quest to spread joy leads her on a journey during which she finds true love.",https://www.imdb.com/title/tt0211915/?ref_=chttp_t_111
112,Like Stars on Earth,2007,Aamir Khan,162,477.0,"Coming-of-Age, Drama, Family, Back to top","Aamir Khan, Amole Gupte, Darsheel Safary, Tisca Chopra, Vipin Sharma, Tanay Chheda",8.3,A young boy is thought to be nothing but a lazy troublemaker until the new art teacher has the patience and compassion to discover the real problem behind his struggles in school.,https://www.imdb.com/title/tt0986264/?ref_=chttp_t_112
113,A Separation,2011,Asghar Farhadi,123,463.0,"Legal Drama, Psychological Drama, Drama, Back to top","Asghar Farhadi, Payman Maadi, Leila Hatami, Sareh Bayat, Shahab Hosseini, Sarina Farhadi",8.3,A married couple are faced with a difficult decision - to improve the life of their child by moving to another country or to stay in Iran and look after a deteriorating parent who has Alzheimer's disease.,https://www.imdb.com/title/tt1832382/?ref_=chttp_t_113
114,To Kill a Mockingbird,1962,Robert Mulligan,129,669.0,"Legal Drama, Period Drama, Crime, Drama, Back to top","Robert Mulligan, Harper Lee, Horton Foote, Gregory Peck, John Megna, Frank Overton",8.3,A widowed lawyer in Depression-era Alabama defends a black man against a false rape charge while teaching his young children about the sad reality of prejudice.,https://www.imdb.com/title/tt0056592/?ref_=chttp_t_114
115,Die Hard,1988,John McTiernan,132,1200.0,"Disaster, Action, Holiday, Thriller, Back to top","John McTiernan, Roderick Thorp, Jeb Stuart, Steven E. de Souza, Bruce Willis, Alan Rickman",8.2,"A New York City cop, John McClane, tries to save his estranged wife and several others taken hostage by terrorists during a Christmas Eve party at the Nakatomi Plaza Skyscraper in Los Angeles, California.",https://www.imdb.com/title/tt0095016/?ref_=chttp_t_115
116,Indiana Jones and the Last Crusade,1989,Steven Spielberg,127,765.0,"Adventure Epic, Desert Adventure, Quest, Action, Adventure","Steven Spielberg, Jeffrey Boam, George Lucas, Menno Meyjes, Harrison Ford, Sean Connery",8.2,"In 1938, after his father goes missing while pursuing the Holy Grail, Indiana Jones finds himself up against the Nazis again to stop them from obtaining its powers.",https://www.imdb.com/title/tt0097576/?ref_=chttp_t_116
117,The Sting,1973,George Roy Hill,129,406.0,"Caper, Comedy, Crime, Drama, Back to top","George Roy Hill, David S. Ward, Paul Newman, Robert Redford, Robert Shaw, Charles Durning",8.2,Two grifters team up to pull off the ultimate con.,https://www.imdb.com/title/tt0070735/?ref_=chttp_t_117
118,A Clockwork Orange,1971,Stanley Kubrick,136,1800.0,"Dark Comedy, Dystopian Sci-Fi, Crime, Sci-Fi, Back to top","Stanley Kubrick, Anthony Burgess, Malcolm McDowell, Patrick Magee, Michael Bates, Warren Clarke",8.2,Alex DeLarge and his droogs barbarize a decaying near-future.,https://www.imdb.com/title/tt0066921/?ref_=chttp_t_118
119,The Chaos Class Failed the Class,1975,Ertem Egilmez,95,6.0,"Satire, Comedy, Back to top","Ertem Egilmez, Sadik Sendil, Rifat Ilgaz, Münir Özkul, Tarik Akan, Kemal Sunal",8.7,A young and beautiful female teacher starts working in an all boys high school.,https://www.imdb.com/title/tt0252488/?ref_=chttp_t_119
120,Metropolis,1927,Fritz Lang,153,594.0,"Dystopian Sci-Fi, Epic, Sci-Fi Epic, Steampunk, Drama","Fritz Lang, Thea von Harbou, Brigitte Helm, Alfred Abel, Gustav Fröhlich, Rudolf Klein-Rogge",8.3,"In a futuristic city sharply divided between the working class and the city planners, the son of the city's mastermind falls in love with a working-class prophet who predicts the coming of a savior to mediate their differences.",https://www.imdb.com/title/tt0017136/?ref_=chttp_t_120
121,Oppenheimer,2023,Christopher Nolan,180,4400.0,"Docudrama, Epic, Historical Epic, Period Drama, Psychological Drama","Christopher Nolan, Kai Bird, Martin Sherwin, Cillian Murphy, Emily Blunt, Matt Damon",8.3,"A dramatization of the life story of J. Robert Oppenheimer, the physicist who had a large hand in the development of the atomic bombs that brought an end to World War II.",https://www.imdb.com/title/tt15398776/?ref_=chttp_t_121
122,Snatch,2000,Guy Ritchie,102,989.0,"Caper, Dark Comedy, Gangster, Comedy, Crime","Guy Ritchie, Jason Statham, Brad Pitt, Stephen Graham, Vinnie Jones, Ade",8.2,"Unscrupulous boxing promoters, violent bookmakers, a Russian gangster, incompetent amateur robbers and supposedly Jewish jewelers fight to track down a priceless stolen diamond.",https://www.imdb.com/title/tt0208092/?ref_=chttp_t_122
